{
  "protocolVersion": "0.1",
  "objectType": "revocation",
  "revocationId": "x",
  "target": {
    "objectType": "x",
    "refId": "x",
    "digest": "sha256:0000000000000000000000000000000000000000000000000000000000000000"
  },
  "reasonCode": "author_request",
  "scope": "revision",
  "severity": "routine",
  "affectedDigests": [
    "sha256:0000000000000000000000000000000000000000000000000000000000000000"
  ],
  "createdAt": "2026-08-19T00:00:00Z",
  "actor": {
    "actorId": "https://aen.dev/conformance/value",
    "type": "human"
  },
  "digest": "sha256:73cfd539233be4cb2aedef8bd2989a095ac20e5e4eaa75921d672aa3327d3fc6",
  "attestation": {
    "protocolVersion": "0.1",
    "objectType": "attestation",
    "attestationId": "att_fixture",
    "statementDigest": "sha256:60352a3248d3b5eb8b9960a798523d00ed3a149eb85b8dfa444e12ce2fe324df",
    "envelope": {
      "payloadType": "application/vnd.in-toto+json",
      "payload": "eyJfdHlwZSI6Imh0dHBzOi8vaW4tdG90by5pby9TdGF0ZW1lbnQvdjEiLCJwcmVkaWNhdGUiOnsiaXNzdWVkQXQiOiIyMDI2LTA4LTE5VDAwOjAwOjAwWiIsImlzc3VlciI6eyJhY3RvcklkIjoiaHR0cHM6Ly9hZW4uZGV2L2NvbmZvcm1hbmNlL2FjdG9ycy9maXh0dXJlLW5vZGUiLCJ0eXBlIjoibm9kZSJ9LCJyb2xlIjoiY29uZm9ybWFuY2UtZml4dHVyZSIsInNjb3BlIjpbInB1YmxpYyJdfSwicHJlZGljYXRlVHlwZSI6Imh0dHBzOi8vYWVuLmRldi9hdHRlc3RhdGlvbnMvb2JqZWN0L3YwLjEiLCJzdWJqZWN0IjpbeyJkaWdlc3QiOnsic2hhMjU2IjoiNzNjZmQ1MzkyMzNiZTRjYjJhZWRlZjhiZDI5ODlhMDk1YWMyMGU1ZTRlYWE3NTkyMWQ2NzJhYTMzMjdkM2ZjNiJ9LCJuYW1lIjoicmV2b2NhdGlvbjp4In1dfQ==",
      "signatures": [
        {
          "keyid": "https://aen.dev/conformance/keys/fixture-ed25519",
          "sig": "v4BMPbwHBkzfSQcBJXGEJ5KzdEkXFF5xjmBir4LdWadlwdj7KCKn8j0lkjcGcIJMRkKalMEv9ege2FYYtLPTAQ==",
          "algorithm": "Ed25519"
        }
      ]
    },
    "issuer": {
      "actorId": "https://aen.dev/conformance/actors/fixture-node",
      "type": "node"
    },
    "issuedAt": "2026-08-19T00:00:00Z",
    "digest": "sha256:cf7ce834a63a2487b2ada1bafb72bdec2200ca6c087277d9bf92953e4ef7203d"
  }
}
